{
  "version": "1",
  "segment_id": "s001",
  "style": "vibemotion-dev-demo",
  "duration": 24,
  "first_slice": true,
  "shots": [
    {
      "shot_id": "s001_sh001",
      "time": [0.0, 3.0],
      "recipe": "dark_grid_intro",
      "renderer": "remotion",
      "component": "DarkGridWorld",
      "visual_owner": "KeywordActor",
      "camera": "slow_push_in",
      "narration_beats": ["b001"],
      "visual_actions": [
        {
          "at": 0.2,
          "type": "keyword_pop",
          "text": "AI 视频为什么不像？",
          "motion": "scale_blur_in",
          "sfx": "soft_pop"
        },
        {
          "at": 1.3,
          "type": "screenshot_enter",
          "asset": "bad_example_ui",
          "motion": "slide_up_crop_focus",
          "sfx": "soft_whoosh",
          "annotation": "static_area_highlight"
        },
        {
          "at": 2.4,
          "type": "redbox_focus",
          "asset": "bad_example_ui",
          "motion": "redbox_draw_plus_crop_push",
          "sfx": "marker",
          "annotation": "subtitle_is_not_the_main_picture"
        }
      ],
      "text_strategy": "keyword_flower_plus_small_caption",
      "transition_out": "whip_to_terminal_because_claim_needs_proof",
      "qa_notes": "Hook shows the failure visually before explaining it."
    },
    {
      "shot_id": "s001_sh002",
      "time": [3.0, 8.5],
      "recipe": "terminal_proof",
      "renderer": "remotion",
      "component": "TerminalProofScene",
      "visual_owner": "TerminalProof",
      "camera": "push_to_command_then_pan_output",
      "narration_beats": ["b002", "b003"],
      "visual_actions": [
        {
          "at": 3.2,
          "type": "terminal_command_typing",
          "text": "python render.py --slice 24",
          "motion": "line_reveal_with_cursor_focus",
          "sfx": "keyboard_tick"
        },
        {
          "at": 4.3,
          "type": "terminal_output_highlight",
          "asset": "render_log",
          "motion": "crop_push_to_warning_line",
          "sfx": "tick"
        },
        {
          "at": 5.4,
          "type": "code_file_reveal",
          "asset": "segment_spec_json",
          "motion": "push_in_line_highlight",
          "sfx": "keyboard_tick"
        },
        {
          "at": 6.6,
          "type": "cursor_click",
          "asset": "segment_spec_json",
          "motion": "cursor_to_visual_owner_field",
          "sfx": "click"
        },
        {
          "at": 7.6,
          "type": "keyword_pop",
          "text": "visual owner",
          "motion": "snap_to_code_label",
          "sfx": "soft_pop"
        },
        {
          "at": 8.3,
          "type": "macro_scene_reset",
          "text": "换到分析房间",
          "motion": "terminal_grid_wipe_to_dashboard",
          "sfx": "whoosh"
        }
      ],
      "text_strategy": "subtitle_low_weight_code_labels_high_weight",
      "transition_out": "grid_wipe_to_dashboard_because_terminal_proof_becomes_analysis",
      "qa_notes": "Proof scene must feel like a real command, not pasted terminal text."
    },
    {
      "shot_id": "s001_sh003",
      "time": [8.5, 14.5],
      "recipe": "dashboard_room",
      "renderer": "hyperframes",
      "component": "ActionDashboardRoom",
      "delegation": {
        "skill": "hyperframes",
        "purpose": "Build a dashboard room that turns beat timing into visible action density.",
        "input_artifacts": ["outputs/beat_plan.json", "outputs/segment_spec.json"],
        "output_artifacts": ["segments/S001/action_dashboard_room.mp4"],
        "acceptance": "9:16 readable, seekable, same dark grid style, no static card longer than 1.5s"
      },
      "visual_owner": "ActionDashboard",
      "camera": "lateral_follow_playhead",
      "narration_beats": ["b004", "b005"],
      "visual_actions": [
        {
          "at": 8.7,
          "type": "dashboard_card_stack_enter",
          "text": "beats",
          "motion": "card_stack_enter_with_crop_focus",
          "sfx": "soft_whoosh"
        },
        {
          "at": 9.8,
          "type": "timeline_marker_pop",
          "text": "0.8s",
          "motion": "marker_snap",
          "sfx": "tick"
        },
        {
          "at": 10.9,
          "type": "visual_action_tick",
          "text": "redbox / cursor / zoom",
          "motion": "line_draw_to_action_icons",
          "sfx": "tick"
        },
        {
          "at": 12.0,
          "type": "screenshot_redbox_focus",
          "asset": "proof_screenshot",
          "motion": "crop_push_redbox_draw",
          "sfx": "marker"
        },
        {
          "at": 13.2,
          "type": "audio_waveform_marker",
          "text": "keyword stress",
          "motion": "waveform_pulse_on_marker",
          "sfx": "tick"
        },
        {
          "at": 14.2,
          "type": "transition_shared_object",
          "text": "时间线变 Git 图",
          "motion": "playhead_morph_to_git_node",
          "sfx": "whoosh"
        }
      ],
      "text_strategy": "labels_attached_to_cards_and_waveform",
      "transition_out": "shared_playhead_morph_because_timing_becomes_structure",
      "qa_notes": "Delegated HyperFrames scene must return a composable MP4 and retain the same grid world."
    },
    {
      "shot_id": "s001_sh004",
      "time": [14.5, 20.0],
      "recipe": "git_graph_growth",
      "renderer": "motion-canvas",
      "component": "ShotGraphGrowth",
      "delegation": {
        "skill": "motion-canvas",
        "purpose": "Animate visual-owner beats as a growing graph of shots and actions.",
        "input_artifacts": ["outputs/beat_plan.json", "outputs/audio_cue_sheet.json"],
        "output_artifacts": ["segments/S001/shot_graph_growth.mp4"],
        "acceptance": "Nodes grow in narration order; labels remain readable; last frame can cut to conclusion stamp"
      },
      "visual_owner": "GitGraphGrowth",
      "camera": "follow_branch_growth",
      "narration_beats": ["b006", "b007"],
      "visual_actions": [
        {
          "at": 14.7,
          "type": "git_node_pop",
          "text": "hook",
          "motion": "node_pop_from_playhead",
          "sfx": "node_pop"
        },
        {
          "at": 15.8,
          "type": "branch_draw",
          "text": "proof",
          "motion": "line_draw_to_terminal_node",
          "sfx": "line_whoosh"
        },
        {
          "at": 16.9,
          "type": "branch_draw",
          "text": "analysis",
          "motion": "line_draw_to_dashboard_node",
          "sfx": "line_whoosh"
        },
        {
          "at": 18.0,
          "type": "timeline_rewind",
          "text": "repair",
          "motion": "playhead_rewind_to_failed_gap",
          "sfx": "reverse_whoosh"
        },
        {
          "at": 19.1,
          "type": "redbox_focus",
          "asset": "failed_gap_node",
          "motion": "redbox_draw_plus_zoom",
          "sfx": "marker"
        }
      ],
      "text_strategy": "graph_node_labels_plus_bottom_caption",
      "transition_out": "cut_on_marker_to_conclusion_stamp",
      "qa_notes": "This is a concept visualization, so path direction must match narration order."
    },
    {
      "shot_id": "s001_sh005",
      "time": [20.0, 24.0],
      "recipe": "conclusion_stamp",
      "renderer": "remotion",
      "component": "ConclusionStamp",
      "visual_owner": "ConclusionStamp",
      "camera": "quick_push_then_hold",
      "narration_beats": ["b008"],
      "visual_actions": [
        {
          "at": 20.2,
          "type": "proof_thumbnail_stack",
          "asset": "first_slice_contact_sheet",
          "motion": "stack_enter_with_focus",
          "sfx": "soft_whoosh"
        },
        {
          "at": 21.3,
          "type": "keyword_pop",
          "text": "先做切片",
          "motion": "scale_snap",
          "sfx": "soft_pop"
        },
        {
          "at": 22.4,
          "type": "conclusion_stamp",
          "text": "不通过就修镜头",
          "motion": "stamp_hit",
          "sfx": "stamp"
        },
        {
          "at": 23.4,
          "type": "audio_tail_breathe",
          "text": "review",
          "motion": "grid_pulse_fade",
          "sfx": "intentional_silence"
        }
      ],
      "text_strategy": "short_verdict_plus_visual_memory",
      "transition_out": "end_first_slice_for_review",
      "qa_notes": "Conclusion recalls prior proof thumbnails so it is not just a text card."
    }
  ]
}
